{"componentChunkName":"component---src-templates-default-js","path":"/anfrage","result":{"pageContext":{"background":"red-light","description":"Wichtige Angaben, die wir für eine Kalkulation benötigen","layout":"default","navigation":"Anfrage","order":1,"robots":"follow","title":"Anfrage","body":"var _excluded = [\"components\"];\n\nfunction _extends() { _extends = Object.assign ? Object.assign.bind() : function (target) { for (var i = 1; i < arguments.length; i++) { var source = arguments[i]; for (var key in source) { if (Object.prototype.hasOwnProperty.call(source, key)) { target[key] = source[key]; } } } return target; }; return _extends.apply(this, arguments); }\n\nfunction _objectWithoutProperties(source, excluded) { if (source == null) return {}; var target = _objectWithoutPropertiesLoose(source, excluded); var key, i; if (Object.getOwnPropertySymbols) { var sourceSymbolKeys = Object.getOwnPropertySymbols(source); for (i = 0; i < sourceSymbolKeys.length; i++) { key = sourceSymbolKeys[i]; if (excluded.indexOf(key) >= 0) continue; if (!Object.prototype.propertyIsEnumerable.call(source, key)) continue; target[key] = source[key]; } } return target; }\n\nfunction _objectWithoutPropertiesLoose(source, excluded) { if (source == null) return {}; var target = {}; var sourceKeys = Object.keys(source); var key, i; for (i = 0; i < sourceKeys.length; i++) { key = sourceKeys[i]; if (excluded.indexOf(key) >= 0) continue; target[key] = source[key]; } return target; }\n\n/* @jsxRuntime classic */\n\n/* @jsx mdx */\nvar _frontmatter = {\n  \"layout\": \"default\",\n  \"title\": \"Anfrage\",\n  \"navigation\": \"Anfrage\",\n  \"background\": \"red-light\",\n  \"order\": 1,\n  \"description\": \"Wichtige Angaben, die wir für eine Kalkulation benötigen\",\n  \"robots\": \"follow\"\n};\nvar layoutProps = {\n  _frontmatter: _frontmatter\n};\nvar MDXLayout = \"wrapper\";\nreturn function MDXContent(_ref) {\n  var components = _ref.components,\n      props = _objectWithoutProperties(_ref, _excluded);\n\n  return mdx(MDXLayout, _extends({}, layoutProps, props, {\n    components: components,\n    mdxType: \"MDXLayout\"\n  }), mdx(\"div\", {\n    className: \"flowing-text\"\n  }, mdx(\"h2\", null, \"Wichtige Angaben, die wir f\\xFCr eine Kalkulation ben\\xF6tigen:\"), mdx(\"br\", null), mdx(\"ol\", null, mdx(\"li\", null, \"Name\"), mdx(\"li\", null, \"Telefonnummer (f\\xFCr R\\xFCckfragen)\"), mdx(\"li\", null, \"Stichwort\"), mdx(\"li\", null, \"Produkt (Buch, Flyer, Postkarte, Visitenkarte ...)\"), mdx(\"li\", null, \"Format\", mdx(\"br\", null), \"Geben Sie bitte die genauen Ma\\xDFe Ihres Druckprodukts an und zwar das Endformat.\"), mdx(\"li\", null, \"Seitenanzahl\", mdx(\"br\", null), \"Bei einem mehrseitigen Produkt bitte die exakte Seitenanzahl angeben.\"), mdx(\"li\", null, \"Farbigkeit\", mdx(\"br\", null), \"Beide Seiten farbig (4/4-farbig),\", mdx(\"br\", null), \"Die Vorderseite farbig und die Ru\\u0308ckseite schwarz (4/1-farbig)\", mdx(\"br\", null), \"Nur eine Seite farbig und die andere Seite blanko (4/0-farbig)\", mdx(\"br\", null), \"Vorderseite und Ru\\u0308ckseite schwarz (1/1-farbig)\", mdx(\"br\", null), \"Nur eine Seite schwarz und die andere Seite blanko (1/0-farbig)\"), mdx(\"li\", null, \"Papier und Gewicht\", mdx(\"br\", null), mdx(\"b\", null, \"Beispiel:\"), mdx(\"br\", null), \"Munken Lynx 120g/qm oder Bilderdruck matt 170g/qm\"), mdx(\"li\", null, \"Verarbeitung\", mdx(\"br\", null), \"Wenn Ihr Produkt weiterverarbeitet werden soll, geben Sie bitte die Art an.\", mdx(\"br\", null), \"Dies gilt f\\xFCr alle Formen der Weiterverarbeitung und Veredelung.\", mdx(\"br\", null), mdx(\"strong\", null, \"Beispielsweise:\"), mdx(\"br\", null), mdx(\"b\", null, \"Bindeart:\"), \" Softcover oder Hardcover, Klebebindung oder Fadenheftung\", mdx(\"br\", null), mdx(\"b\", null, \"Falzart:\"), \" Wickelfalz, Zickzackfalz, Altarfalz\", mdx(\"br\", null), mdx(\"b\", null, \"Cellophanierung:\"), \" matt, gl\\xE4nzend, Soft-Touch-Folie\", mdx(\"br\", null), mdx(\"b\", null, \"Pr\\xE4gung:\"), \" blind (ohne Farbe nur tiefgepr\\xE4gt), Hei\\xDFfolienpr\\xE4gung (mit Farbe)\"), mdx(\"li\", null, \"Auflage\"), mdx(\"li\", null, \"Gew\\xFCnschter Fertigstellungstermin\")), mdx(\"br\", null), mdx(\"h2\", null, \"Via Email direkt\"), mdx(\"ul\", null, mdx(\"li\", null, mdx(\"a\", {\n    href: \"mailto:muellerprints@t-online.de\"\n  }, \"muellerprints. Digitaldruck\")), mdx(\"li\", null, mdx(\"a\", {\n    href: \"mailto:info@buchbinderei-mende.de\"\n  }, \"Buchbinderei Mende\"))), mdx(\"br\", null), mdx(\"a\", {\n    id: \"form\"\n  }), mdx(\"h2\", null, \"Der bessere Weg \\u2014 \", mdx(\"br\", null), \"Anfrageformular ausf\\xFCllen und abschicken\"), mdx(\"div\", {\n    className: \"text-small\"\n  }, \"[*] Pflichtangaben\"), mdx(\"br\", null), mdx(\"div\", null, mdx(\"div\", {\n    id: \"success\",\n    className: \"alert alert-info\",\n    style: {\n      \"display\": \"none\"\n    }\n  }, mdx(\"center\", null, \"Ihre Anfrage wurde erfolgreich verschickt! Bei R\\xFCckfragen k\\xF6nnen Sie uns werktags unter + 49 (0)711 / 262 49 64 erreichen.\")), mdx(\"div\", {\n    id: \"notifications\",\n    className: \"alert alert-danger\",\n    style: {\n      \"display\": \"none\"\n    }\n  }), mdx(\"div\", {\n    className: \"row\"\n  }, mdx(\"form\", {\n    className: \"form\",\n    method: \"POST\",\n    id: \"inquiry\"\n  }, mdx(\"div\", {\n    className: \"form-group\"\n  }, mdx(\"label\", {\n    htmlFor: \"inputName\",\n    className: \"control-label col-sm-8\"\n  }, \"Vor- & Nachname *\"), mdx(\"div\", {\n    className: \"col-sm-8\"\n  }, mdx(\"input\", {\n    type: \"text\",\n    className: \"form-control\",\n    placeholder: \"\",\n    name: \"name\"\n  }), mdx(\"span\", {\n    className: \"help-block\"\n  }))), mdx(\"div\", {\n    className: \"form-group\"\n  }, mdx(\"label\", {\n    htmlFor: \"inputPhone\",\n    className: \"control-label col-sm-8\"\n  }, \"Telefonnummer [f\\xFCr R\\xFCckfragen] *\"), mdx(\"div\", {\n    className: \"col-sm-8\"\n  }, mdx(\"input\", {\n    type: \"text\",\n    className: \"form-control\",\n    placeholder: \"\",\n    name: \"phone\"\n  }), mdx(\"span\", {\n    className: \"help-block\"\n  }))), mdx(\"div\", {\n    className: \"form-group\"\n  }, mdx(\"label\", {\n    htmlFor: \"inputEmail\",\n    className: \"control-label col-sm-8\"\n  }, \"E-Mail-Adresse *\"), mdx(\"div\", {\n    className: \"col-sm-8\"\n  }, mdx(\"input\", {\n    type: \"text\",\n    className: \"form-control\",\n    placeholder: \"\",\n    name: \"mail\"\n  }), mdx(\"span\", {\n    className: \"help-block\"\n  }))), mdx(\"div\", {\n    className: \"form-group\"\n  }, mdx(\"label\", {\n    htmlFor: \"inputKeyword\",\n    className: \"control-label col-sm-8\"\n  }, \"Stichwort [Artbeitstitel, Dateiname, ...] *\"), mdx(\"div\", {\n    className: \"col-sm-8\"\n  }, mdx(\"input\", {\n    type: \"text\",\n    className: \"form-control\",\n    placeholder: \"\",\n    name: \"title\"\n  }), mdx(\"span\", {\n    className: \"help-block\"\n  }))), mdx(\"div\", {\n    className: \"form-group\"\n  }, mdx(\"label\", {\n    htmlFor: \"inputProduct\",\n    className: \"control-label col-sm-8\"\n  }, \"Produkt [Buch, Heft, Flyer, Postkarte, ...] *\"), mdx(\"div\", {\n    className: \"col-sm-8\"\n  }, mdx(\"input\", {\n    type: \"text\",\n    className: \"form-control\",\n    placeholder: \"\",\n    name: \"product\"\n  }), mdx(\"span\", {\n    className: \"help-block\"\n  }))), mdx(\"div\", {\n    className: \"form-group\"\n  }, mdx(\"label\", {\n    htmlFor: \"inputSice\",\n    className: \"control-label col-sm-8\"\n  }, \"Format [mm] *\"), mdx(\"div\", {\n    className: \"col-sm-8\"\n  }, mdx(\"input\", {\n    type: \"text\",\n    className: \"form-control\",\n    placeholder: \"\",\n    name: \"format\"\n  }), mdx(\"span\", {\n    className: \"help-block\"\n  }))), mdx(\"div\", {\n    className: \"form-group\"\n  }, mdx(\"label\", {\n    htmlFor: \"inputPages\",\n    className: \"control-label col-sm-8\"\n  }, \"Seitenanzahl *\"), mdx(\"div\", {\n    className: \"col-sm-8\"\n  }, mdx(\"input\", {\n    type: \"text\",\n    className: \"form-control\",\n    placeholder: \"\",\n    name: \"pages\"\n  }), mdx(\"span\", {\n    className: \"help-block\"\n  }))), mdx(\"div\", {\n    className: \"form-group\"\n  }, mdx(\"label\", {\n    htmlFor: \"inputFormat\",\n    className: \"control-label col-sm-8\"\n  }, \"Ausrichtung *\"), mdx(\"div\", {\n    className: \"col-sm-8\"\n  }, mdx(\"select\", {\n    className: \"form-control input \",\n    \"data-style\": \"form-control\",\n    name: \"orientation\"\n  }, mdx(\"option\", null, \"Hochformat\"), mdx(\"option\", null, \"Querformat\")))), mdx(\"div\", {\n    className: \"form-group\"\n  }, mdx(\"label\", {\n    htmlFor: \"inputPrint\",\n    className: \"control-label col-sm-8\"\n  }, \"Druck [Farbigkeit] *\"), mdx(\"div\", {\n    className: \"col-sm-8\"\n  }, mdx(\"select\", {\n    className: \"form-control \",\n    \"data-style\": \"form-control\",\n    name: \"printing\"\n  }, mdx(\"option\", null, \"1-seitig [nur Vorderseite bedruckt]\"), mdx(\"option\", null, \"2-seitig [Vorder- & R\\xFCckseite bedruck] duplex\")))), mdx(\"div\", {\n    className: \"form-group\"\n  }, mdx(\"label\", {\n    htmlFor: \"inputColors\",\n    className: \"control-label col-sm-8\"\n  }, \"Farbe *\"), mdx(\"div\", {\n    className: \"col-sm-8\"\n  }, mdx(\"select\", {\n    className: \" form-control\",\n    \"data-style\": \"form-control\",\n    name: \"colors\"\n  }, mdx(\"option\", null, \"1/0 farbig schwarz/blanko\"), mdx(\"option\", null, \"1/1 farbig schwarz/schwarz\"), mdx(\"option\", null, \"4/0 farbig Euroskala/blanko\"), mdx(\"option\", null, \"4/1 farbig Euroskala/schwarz\"), mdx(\"option\", null, \"4/4 farbig Euroskala/Euroskala\")))), mdx(\"div\", {\n    className: \"form-group\"\n  }, mdx(\"label\", {\n    htmlFor: \"inputPaper\",\n    className: \"control-label col-sm-8\"\n  }, \"Papier, Gewicht [z.B. Munken Lynx 120g/m\\xB2] *\"), mdx(\"div\", {\n    className: \"col-sm-8\"\n  }, mdx(\"input\", {\n    type: \"text\",\n    className: \"form-control\",\n    placeholder: \"\",\n    name: \"material\"\n  }), mdx(\"span\", {\n    className: \"help-block\"\n  }))), mdx(\"div\", {\n    className: \"form-group\"\n  }, mdx(\"label\", {\n    htmlFor: \"inputEdition\",\n    className: \"control-label col-sm-8\"\n  }, \"Auflage [St\\xFCckzahl] *\"), mdx(\"div\", {\n    className: \"col-sm-8\"\n  }, mdx(\"input\", {\n    type: \"text\",\n    className: \"form-control\",\n    placeholder: \"\",\n    name: \"edition\"\n  }), mdx(\"span\", {\n    className: \"help-block\"\n  }))), mdx(\"div\", {\n    className: \"form-group\"\n  }, mdx(\"label\", {\n    htmlFor: \"inputMessage\",\n    className: \"control-label col-sm-8\"\n  }, \"Objektbeschreibung [Bindeart: Hardcover, Softcover, Veredelung, Pr\\xE4gung, Liefertermin, etc.]\"), mdx(\"div\", {\n    className: \"col-sm-8\"\n  }, mdx(\"textarea\", {\n    rows: \"6\",\n    className: \"form-control\",\n    name: \"description\"\n  }))), mdx(\"div\", {\n    className: \"form-group\"\n  }, mdx(\"div\", {\n    className: \"col-sm-8\"\n  }, mdx(\"br\", null), mdx(\"br\", null), mdx(\"button\", {\n    type: \"submit\",\n    className: \"btn btn-primary\"\n  }, \"Abschicken\"))))))));\n}\n;\nMDXContent.isMDXComponent = true;"}},"staticQueryHashes":["1348940310"]}