{
    "componentChunkName": "component---src-templates-default-js",
    "path": "/daten",
    "result": {"pageContext":{"background":"gray","description":"Druckdaten für den Digitaldruck","layout":"default","navigation":"Daten","order":5,"robots":"follow","title":"Daten","body":"var _excluded = [\"components\"];\n\nfunction _extends() { _extends = Object.assign || function (target) { for (var i = 1; i < arguments.length; i++) { var source = arguments[i]; for (var key in source) { if (Object.prototype.hasOwnProperty.call(source, key)) { target[key] = source[key]; } } } return target; }; return _extends.apply(this, arguments); }\n\nfunction _objectWithoutProperties(source, excluded) { if (source == null) return {}; var target = _objectWithoutPropertiesLoose(source, excluded); var key, i; if (Object.getOwnPropertySymbols) { var sourceSymbolKeys = Object.getOwnPropertySymbols(source); for (i = 0; i < sourceSymbolKeys.length; i++) { key = sourceSymbolKeys[i]; if (excluded.indexOf(key) >= 0) continue; if (!Object.prototype.propertyIsEnumerable.call(source, key)) continue; target[key] = source[key]; } } return target; }\n\nfunction _objectWithoutPropertiesLoose(source, excluded) { if (source == null) return {}; var target = {}; var sourceKeys = Object.keys(source); var key, i; for (i = 0; i < sourceKeys.length; i++) { key = sourceKeys[i]; if (excluded.indexOf(key) >= 0) continue; target[key] = source[key]; } return target; }\n\n/* @jsxRuntime classic */\n\n/* @jsx mdx */\nvar _frontmatter = {\n  \"layout\": \"default\",\n  \"title\": \"Daten\",\n  \"background\": \"gray\",\n  \"navigation\": \"Daten\",\n  \"order\": 5,\n  \"description\": \"Druckdaten für den Digitaldruck\",\n  \"robots\": \"follow\"\n};\nvar layoutProps = {\n  _frontmatter: _frontmatter\n};\nvar MDXLayout = \"wrapper\";\nreturn function MDXContent(_ref) {\n  var components = _ref.components,\n      props = _objectWithoutProperties(_ref, _excluded);\n\n  return mdx(MDXLayout, _extends({}, layoutProps, props, {\n    components: components,\n    mdxType: \"MDXLayout\"\n  }), mdx(\"div\", {\n    className: \"flowing-text\"\n  }, mdx(\"h2\", null, \"Druckdaten f\\xFCr den Digitaldruck\"), mdx(\"br\", null), mdx(\"h3\", null, \"Benennung der Druckdaten\"), mdx(\"ul\", null, mdx(\"li\", null, \"Es ist wichtig, dass Sie Ihre Druckdateien eindeutig benennen. Also nicht \\u201EFlyer\\u201C oder \\u201EBachelorarbeit\\u201C oder \\u201EBuch\\u201C, sondern \\u201EM_M\\xFCller_flyer_final_print_2018\\u201C.\")), mdx(\"h3\", null, \"Dateiformate\"), mdx(\"ul\", null, mdx(\"li\", null, \"Liefern Sie uns optimalerweise ein druckfertiges, druckf\\xE4higes PDF - \", mdx(\"b\", null, \"PDF/X-3:2003\"), \" oder \", mdx(\"b\", null, \"PDF/X-4:2010\")), mdx(\"li\", null, \"Oder offene Programmdateien von Microsoft Office, \", mdx(\"b\", null, \"Adobe InDesign CC\"), \", \", mdx(\"b\", null, \"Adobe Illustrator CC\"), \", \", mdx(\"b\", null, \"Adobe Photoshop CC\"), \".\"), mdx(\"li\", null, \" Wenn Sie uns die offenen Programmdateien \\xFCbergeben, dann wandeln Sie entweder alle Schirften in Pfade um, bzw. stellen Sie uns alle verwendeten Schriften zur Verf\\xFCgung und betten Sie alle Bilder ein, bzw. schicken Sie alle verkn\\xFCpften Bilder mit.\")), mdx(\"h3\", null, \"Beschnittzugabe\"), mdx(\"ul\", null, mdx(\"li\", null, \"Falls Fl\\xE4chen oder Bilder ganzformatig, randlos dargestellt werden sollen, sollten Sie eine Beschnittzugabe von 3mm an allen vier Seiten anlegen. Fl\\xE4chen oder Bilder m\\xFCssen also 3mm \\xFCber den Rand (das Format) hinausragen. Soll das beschittene Endformat 210x297mm sein, ist das zu druckende Rohformat 216x303mm.\")), mdx(\"h3\", null, \"Schnittmarken\"), mdx(\"ul\", null, mdx(\"li\", null, \"Generell ben\\xF6tigen wir keine Schnittmarken. Falls Sie trotzdem Marken einf\\xFCgen, sollte der Abstand der Marken zum Endformat (\", mdx(\"b\", null, \"Versatz\"), \") genau so gro\\xDF sein, wie die Beschnittzugabe. D.h. bei einer Beschnittzugabe von 3mm mu\\xDF der Versatz ebenfalls 3mm betragen, bei 18mm Beschnitt ist der Versatz auf 18mm einzustellen.\"), mdx(\"li\", null, \"Und - bitte nur Schnittmarken ausw\\xE4hlen!\")), mdx(\"h3\", null, \"Farbprofile\"), mdx(\"ul\", null, mdx(\"li\", null, \"Verwenden Sie eines der folgenden Profile:\"), mdx(\"b\", null, \"ISOcoated_v2_eci.icc / CoatedFOGRA27.icc / CoatedFOGRA39.icc\")), mdx(\"h3\", null, \"Farbraum\"), mdx(\"ul\", null, mdx(\"li\", null, \"Das beste Druckergebnis erhalten Sie, wenn Sie alle \", mdx(\"b\", null, \"Bilder im Photoshop in CMYK \"), \"konvertieren.\")), mdx(\"br\", null), mdx(\"h3\", null, \"PDF Exportvorgabe \", mdx(\"small\", null, \"(Kurzfassung)\")), mdx(\"b\", null, \"Standard:\"), \" PDF/X-4:2010\", mdx(\"br\", null), mdx(\"h3\", null, \"Allgemein\"), mdx(\"ul\", null, mdx(\"b\", null, \"Bereich:\"), \" Alle Seiten\", mdx(\"br\", null), mdx(\"b\", null, \"Seiten\"), \" (nicht Druckb\\xF6gen)\", mdx(\"br\", null), mdx(\"b\", null, \"Komprimierung\"), \" \\u21D2 wie Voreinstellung\", mdx(\"br\", null), mdx(\"b\", null, \"Marken und Anschnitt\"), \" \\u21D2 \", mdx(\"b\", null, \"Schnittmarken\"), \" \\u21D2\", mdx(\"b\", null, \"Versatz\"), \" = 3mm \\u21D2 \", mdx(\"b\", null, \"Anschnitt\"), \" oben, unten, links, rechts = 3mm\", mdx(\"br\", null), mdx(\"b\", null, \"Ausgabe\"), \" \\u21D2 \", mdx(\"b\", null, \"Farbe\"), \" \\u21D2 \", mdx(\"b\", null, \"In Zielprofil konvertieren\"), \" (Werte beibehalten)\", mdx(\"br\", null), mdx(\"b\", null, \"Ziel: ISOcoated_v2_eci.icc\"), mdx(\"br\", null), mdx(\"b\", null, \"PDF/X\"), \" \\u21D2 Name des Ausgabeprofils = \", mdx(\"b\", null, \"ISOcoated_v2_eci.icc\"), mdx(\"br\", null), \"[Wenn Sie \", mdx(\"b\", null, \"ISOcoated_v2_eci.icc\"), \" nicht zur Verf\\xFCgung haben, ersetzen Sie es einfach durch \", mdx(\"b\", null, \" CoatedFOGRA27.icc \"), \" oder\", mdx(\"b\", null, \" CoatedFOGRA39.icc\"), \"]\", mdx(\"br\", null), mdx(\"b\", null, \"Exportieren\")), mdx(\"br\", null), mdx(\"h2\", null, \"Download\"), mdx(\"ul\", null, mdx(\"li\", null, mdx(\"a\", {\n    href: \"/images/PDF-Exportvorgabe.pdf\",\n    target: \"_blank\"\n  }, \"PDF- Exportvorgabe\")))));\n}\n;\nMDXContent.isMDXComponent = true;"}},
    "staticQueryHashes": ["1348940310"]}