{
    "componentChunkName": "component---src-templates-default-js",
    "path": "/bestellung",
    "result": {"pageContext":{"background":"orange-dark","description":"Druckauftrag abschicken","layout":"default","navigation":"Bestellung","order":3,"robots":null,"title":"Druckauftrag","body":"var _excluded = [\"components\"];\n\nfunction _extends() { _extends = Object.assign || function (target) { for (var i = 1; i < arguments.length; i++) { var source = arguments[i]; for (var key in source) { if (Object.prototype.hasOwnProperty.call(source, key)) { target[key] = source[key]; } } } return target; }; return _extends.apply(this, arguments); }\n\nfunction _objectWithoutProperties(source, excluded) { if (source == null) return {}; var target = _objectWithoutPropertiesLoose(source, excluded); var key, i; if (Object.getOwnPropertySymbols) { var sourceSymbolKeys = Object.getOwnPropertySymbols(source); for (i = 0; i < sourceSymbolKeys.length; i++) { key = sourceSymbolKeys[i]; if (excluded.indexOf(key) >= 0) continue; if (!Object.prototype.propertyIsEnumerable.call(source, key)) continue; target[key] = source[key]; } } return target; }\n\nfunction _objectWithoutPropertiesLoose(source, excluded) { if (source == null) return {}; var target = {}; var sourceKeys = Object.keys(source); var key, i; for (i = 0; i < sourceKeys.length; i++) { key = sourceKeys[i]; if (excluded.indexOf(key) >= 0) continue; target[key] = source[key]; } return target; }\n\n/* @jsxRuntime classic */\n\n/* @jsx mdx */\nvar _frontmatter = {\n  \"layout\": \"default\",\n  \"title\": \"Druckauftrag\",\n  \"navigation\": \"Bestellung\",\n  \"background\": \"orange-dark\",\n  \"description\": \"Druckauftrag abschicken\",\n  \"order\": 3\n};\nvar layoutProps = {\n  _frontmatter: _frontmatter\n};\nvar MDXLayout = \"wrapper\";\nreturn function MDXContent(_ref) {\n  var components = _ref.components,\n      props = _objectWithoutProperties(_ref, _excluded);\n\n  return mdx(MDXLayout, _extends({}, layoutProps, props, {\n    components: components,\n    mdxType: \"MDXLayout\"\n  }), mdx(\"div\", {\n    className: \"flowing-text\"\n  }, mdx(\"h2\", null, \"Druckauftrag \\xB7 Bestellung\"), mdx(\"br\", null), mdx(\"strong\", null, \"Wenn Sie uns einen Druckauftrag erteilen und uns Ihre Druckdaten schicken, dann f\\xFCllen Sie bitte folgendes Bestellformular und die Checkliste vollst\\xE4ndig aus. Vorheriger Emailverkehr, m\\xFCndliche, bzw. telefonische Absprachen werden nicht ber\\xFCcksichtigt. Dieses Bestellformular ist g\\xFCltig und dient als Auftragsbest\\xE4tigung, sowie verbindliche Checkliste zur Produktions\\xFCberwachung Ihres Auftrages. Bitte \\xFCberpr\\xFCfen Sie deshalb alle Angaben nochmals auf ihre Richtigkeit, bevor Sie das Formular abschicken.\"), mdx(\"br\", null), mdx(\"div\", {\n    id: \"success\",\n    className: \"alert alert-info\",\n    style: {\n      \"display\": \"none\"\n    }\n  }, mdx(\"center\", null, \"Ihre Bestellung wurde erfolgreich verschickt! Bei R\\xFCckfragen k\\xF6nnen Sie uns werktags unter + 49 (0)711 / 262 49 64 erreichen.\", mdx(\"br\", null), mdx(\"b\", null, \"Sie k\\xF6nnen jetzt mit dem Upload-Link Ihre Druckdaten versenden.\"))), mdx(\"div\", {\n    id: \"notifications\",\n    className: \"alert alert-danger\",\n    style: {\n      \"display\": \"none\"\n    }\n  }), mdx(\"div\", {\n    className: \"row\"\n  }, mdx(\"form\", {\n    className: \"form\",\n    method: \"POST\",\n    id: \"checklist\"\n  }, mdx(\"div\", {\n    className: \"col-sm-12\"\n  }, mdx(\"h2\", null, \"Bestellformular bitte sorgf\\xE4ltig ausf\\xFCllen\"), mdx(\"div\", {\n    className: \"text-small\"\n  }, \"[*] Pflichtangaben\"), mdx(\"h3\", null, \"Rechnungsanschrift\")), mdx(\"div\", {\n    className: \"form-group\"\n  }, mdx(\"label\", {\n    htmlFor: \"name\",\n    className: \"control-label col-sm-8\"\n  }, \"Vor- & Nachname *\"), mdx(\"div\", {\n    className: \"col-sm-8\"\n  }, mdx(\"input\", {\n    type: \"text\",\n    className: \"form-control\",\n    placeholder: \"\",\n    id: \"name\",\n    name: \"name\"\n  }), mdx(\"span\", {\n    className: \"help-block\"\n  }))), mdx(\"div\", {\n    className: \"form-group\"\n  }, mdx(\"label\", {\n    htmlFor: \"street\",\n    className: \"control-label col-sm-8\"\n  }, \"Stra\\xDFe *\"), mdx(\"div\", {\n    className: \"col-sm-8\"\n  }, mdx(\"input\", {\n    type: \"text\",\n    className: \"form-control\",\n    placeholder: \"\",\n    id: \"street\",\n    name: \"street\"\n  }), mdx(\"span\", {\n    className: \"help-block\"\n  }))), mdx(\"div\", {\n    className: \"form-group\"\n  }, mdx(\"label\", {\n    htmlFor: \"zip\",\n    className: \"control-label col-sm-8\"\n  }, \"Postleitzahl*\"), mdx(\"div\", {\n    className: \"col-sm-8\"\n  }, mdx(\"input\", {\n    type: \"text\",\n    className: \"form-control\",\n    placeholder: \"\",\n    id: \"zip\",\n    name: \"zip\"\n  }), mdx(\"span\", {\n    className: \"help-block\"\n  }))), mdx(\"div\", {\n    className: \"form-group\"\n  }, mdx(\"label\", {\n    htmlFor: \"town\",\n    className: \"control-label col-sm-5\"\n  }, \"Stadt *\"), mdx(\"div\", {\n    className: \"col-sm-8\"\n  }, mdx(\"input\", {\n    type: \"text\",\n    className: \"form-control\",\n    placeholder: \"\",\n    id: \"town\",\n    name: \"town\"\n  }), mdx(\"span\", {\n    className: \"help-block\"\n  }))), mdx(\"div\", {\n    className: \"form-group\"\n  }, mdx(\"label\", {\n    htmlFor: \"phone\",\n    className: \"control-label col-sm-8\"\n  }, \"Telefonnummer [f\\xFCr R\\xFCckfragen] *\"), mdx(\"div\", {\n    className: \"col-sm-8\"\n  }, mdx(\"input\", {\n    type: \"text\",\n    className: \"form-control\",\n    placeholder: \"\",\n    id: \"phone\",\n    name: \"phone\"\n  }), mdx(\"span\", {\n    className: \"help-block\"\n  }))), mdx(\"div\", {\n    className: \"form-group\"\n  }, mdx(\"label\", {\n    htmlFor: \"mail\",\n    className: \"control-label col-sm-8\"\n  }, \"Email-Adresse *\"), mdx(\"div\", {\n    className: \"col-sm-8\"\n  }, mdx(\"input\", {\n    type: \"text\",\n    className: \"form-control\",\n    placeholder: \"\",\n    id: \"mail\",\n    name: \"mail\"\n  }), mdx(\"span\", {\n    className: \"help-block\"\n  }), mdx(\"br\", null), mdx(\"h3\", null, \"Checkliste f\\xFCr Druck und Weiterverarbeitung\"))), mdx(\"div\", {\n    className: \"form-group\"\n  }, mdx(\"label\", {\n    htmlFor: \"title\",\n    className: \"control-label col-sm-8\"\n  }, \"Stichwort [Artbeitstitel, Dateiname, ...] *\"), mdx(\"div\", {\n    className: \"col-sm-8\"\n  }, mdx(\"input\", {\n    type: \"text\",\n    className: \"form-control\",\n    placeholder: \"\",\n    id: \"title\",\n    name: \"title\"\n  }), mdx(\"span\", {\n    className: \"help-block\"\n  }))), mdx(\"div\", {\n    className: \"form-group\"\n  }, mdx(\"label\", {\n    htmlFor: \"product\",\n    className: \"control-label col-sm-8\"\n  }, \"Produkt [Buch, Heft, Flyer, Postkarte, ...] *\"), mdx(\"div\", {\n    className: \"col-sm-8\"\n  }, mdx(\"input\", {\n    type: \"text\",\n    className: \"form-control\",\n    placeholder: \"\",\n    id: \"product\",\n    name: \"product\"\n  }), mdx(\"span\", {\n    className: \"help-block\"\n  }))), mdx(\"div\", {\n    className: \"form-group\"\n  }, mdx(\"label\", {\n    htmlFor: \"format\",\n    className: \"control-label col-sm-8\"\n  }, \"Beschnittenes Endformat [mm] *\"), mdx(\"div\", {\n    className: \"col-sm-8\"\n  }, mdx(\"input\", {\n    type: \"text\",\n    className: \"form-control\",\n    placeholder: \"\",\n    id: \"format\",\n    name: \"format\"\n  }), mdx(\"span\", {\n    className: \"help-block\"\n  }))), mdx(\"div\", {\n    className: \"form-group\"\n  }, mdx(\"label\", {\n    htmlFor: \"pages\",\n    className: \"control-label col-sm-8\"\n  }, \"Seitenanzahl *\"), mdx(\"div\", {\n    className: \"col-sm-8\"\n  }, mdx(\"input\", {\n    type: \"text\",\n    className: \"form-control\",\n    placeholder: \"\",\n    id: \"pages\",\n    name: \"pages\"\n  }), mdx(\"span\", {\n    className: \"help-block\"\n  }))), mdx(\"div\", {\n    className: \"form-group\"\n  }, mdx(\"label\", {\n    htmlFor: \"orientation\",\n    className: \"control-label col-sm-8\"\n  }, \"Ausrichtung *\"), mdx(\"div\", {\n    className: \"col-sm-8\"\n  }, mdx(\"div\", {\n    className: \"dropdown bootstrap-select form-control input\"\n  }, mdx(\"select\", {\n    className: \"form-control input selectpicker\",\n    \"data-style\": \"form-control\",\n    name: \"orientation\",\n    id: \"orientation\",\n    tabIndex: \"0\"\n  }, mdx(\"option\", null, \"Hochformat\"), mdx(\"option\", null, \"Querformat\")), mdx(\"button\", {\n    type: \"button\",\n    className: \"btn dropdown-toggle form-control\",\n    \"data-toggle\": \"dropdown\",\n    role: \"button\",\n    \"data-id\": \"orientation\",\n    title: \"Hochformat\"\n  }, mdx(\"div\", {\n    className: \"filter-option\"\n  }, mdx(\"div\", {\n    className: \"filter-option-inner\"\n  }, mdx(\"div\", {\n    className: \"filter-option-inner-inner\"\n  }, \"Hochformat\"))), mdx(\"span\", {\n    className: \"bs-caret\"\n  }, mdx(\"span\", {\n    className: \"caret\"\n  }))), mdx(\"div\", {\n    className: \"dropdown-menu open\",\n    role: \"combobox\"\n  }, mdx(\"div\", {\n    className: \"inner open\",\n    role: \"listbox\",\n    \"aria-expanded\": \"false\",\n    tabIndex: \"0\"\n  }, mdx(\"ul\", {\n    className: \"dropdown-menu inner \"\n  })))))), mdx(\"div\", {\n    className: \"form-group\"\n  }, mdx(\"label\", {\n    htmlFor: \"printing\",\n    className: \"control-label col-sm-8\"\n  }, \"Druck [Farbigkeit] *\"), mdx(\"div\", {\n    className: \"col-sm-8\"\n  }, mdx(\"div\", {\n    className: \"dropdown bootstrap-select form-control\"\n  }, mdx(\"select\", {\n    className: \"form-control selectpicker\",\n    \"data-style\": \"form-control\",\n    name: \"printing\",\n    id: \"printing\",\n    tabIndex: \"0\"\n  }, mdx(\"option\", null, \"1-seitig [nur Vorderseite bedruckt]\"), mdx(\"option\", null, \"2-seitig [Vorder- & R\\xFCckseite bedruck] duplex\")), mdx(\"button\", {\n    type: \"button\",\n    className: \"btn dropdown-toggle form-control\",\n    \"data-toggle\": \"dropdown\",\n    role: \"button\",\n    \"data-id\": \"printing\",\n    title: \"1-seitig [nur Vorderseite bedruckt]\"\n  }, mdx(\"div\", {\n    className: \"filter-option\"\n  }, mdx(\"div\", {\n    className: \"filter-option-inner\"\n  }, mdx(\"div\", {\n    className: \"filter-option-inner-inner\"\n  }, \"1-seitig [nur Vorderseite bedruckt]\"))), mdx(\"span\", {\n    className: \"bs-caret\"\n  }, mdx(\"span\", {\n    className: \"caret\"\n  }))), mdx(\"div\", {\n    className: \"dropdown-menu open\",\n    role: \"combobox\"\n  }, mdx(\"div\", {\n    className: \"inner open\",\n    role: \"listbox\",\n    \"aria-expanded\": \"false\",\n    tabIndex: \"0\"\n  }, mdx(\"ul\", {\n    className: \"dropdown-menu inner \"\n  })))))), mdx(\"div\", {\n    className: \"form-group\"\n  }, mdx(\"label\", {\n    htmlFor: \"colors\",\n    className: \"control-label col-sm-8\"\n  }, \"Farbe *\"), mdx(\"div\", {\n    className: \"col-sm-8\"\n  }, mdx(\"div\", {\n    className: \"dropdown bootstrap-select form-control\"\n  }, mdx(\"select\", {\n    className: \"selectpicker form-control\",\n    \"data-style\": \"form-control\",\n    id: \"colors\",\n    name: \"colors\",\n    tabIndex: \"0\"\n  }, mdx(\"option\", null, \"1/0 farbig schwarz/blanko\"), mdx(\"option\", null, \"1/1 farbig schwarz/schwarz\"), mdx(\"option\", null, \"4/0 farbig Euroskala/blanko\"), mdx(\"option\", null, \"4/1 farbig Euroskala/schwarz\"), mdx(\"option\", null, \"4/4 farbig Euroskala/Euroskala\")), mdx(\"button\", {\n    type: \"button\",\n    className: \"btn dropdown-toggle form-control\",\n    \"data-toggle\": \"dropdown\",\n    role: \"button\",\n    \"data-id\": \"colors\",\n    title: \"1/0 farbig schwarz/blanko\"\n  }, mdx(\"div\", {\n    className: \"filter-option\"\n  }, mdx(\"div\", {\n    className: \"filter-option-inner\"\n  }, mdx(\"div\", {\n    className: \"filter-option-inner-inner\"\n  }, \"1/0 farbig schwarz/blanko\"))), mdx(\"span\", {\n    className: \"bs-caret\"\n  }, mdx(\"span\", {\n    className: \"caret\"\n  }))), mdx(\"div\", {\n    className: \"dropdown-menu open\",\n    role: \"combobox\"\n  }, mdx(\"div\", {\n    className: \"inner open\",\n    role: \"listbox\",\n    \"aria-expanded\": \"false\",\n    tabIndex: \"0\"\n  }, mdx(\"ul\", {\n    className: \"dropdown-menu inner \"\n  })))))), mdx(\"div\", {\n    className: \"form-group\"\n  }, mdx(\"label\", {\n    htmlFor: \"material\",\n    className: \"control-label col-sm-8\"\n  }, \"Inhalt - Papier, Gewicht [z.B. Munken Lynx 120g/m\\xB2] *\"), mdx(\"div\", {\n    className: \"col-sm-8\"\n  }, mdx(\"input\", {\n    type: \"text\",\n    className: \"form-control\",\n    placeholder: \"\",\n    id: \"material\",\n    name: \"material\"\n  }), mdx(\"span\", {\n    className: \"help-block\"\n  }))), mdx(\"div\", {\n    className: \"form-group\"\n  }, mdx(\"label\", {\n    htmlFor: \"cover-material\",\n    className: \"control-label col-sm-8\"\n  }, \"Umschlag (Cover) - Papier, Gewicht [z.B. Munken Lynx 300g/m\\xB2] *\"), mdx(\"div\", {\n    className: \"col-sm-8\"\n  }, mdx(\"input\", {\n    type: \"text\",\n    className: \"form-control\",\n    placeholder: \"\",\n    id: \"cover-material\",\n    name: \"cover-material\"\n  }), mdx(\"span\", {\n    className: \"help-block\"\n  }))), mdx(\"div\", {\n    className: \"form-group\"\n  }, mdx(\"label\", {\n    htmlFor: \"edition\",\n    className: \"control-label col-sm-8\"\n  }, \"Auflage [St\\xFCckzahl] *\"), mdx(\"div\", {\n    className: \"col-sm-8\"\n  }, mdx(\"input\", {\n    type: \"text\",\n    className: \"form-control\",\n    placeholder: \"\",\n    id: \"edition\",\n    name: \"edition\"\n  }), mdx(\"span\", {\n    className: \"help-block\"\n  }))), mdx(\"div\", {\n    className: \"form-group\"\n  }, mdx(\"label\", {\n    htmlFor: \"description\",\n    className: \"control-label col-sm-8\"\n  }, \"Verarbeitung [Bindeart, Hardcover, Softcover, Veredelung, Pr\\xE4gung, Cellophanierung, Sonstiges, ...] * \"), mdx(\"div\", {\n    className: \"col-sm-8\"\n  }, mdx(\"textarea\", {\n    type: \"text\",\n    rows: \"6\",\n    className: \"form-control\",\n    id: \"description\",\n    name: \"description\"\n  }))), mdx(\"div\", {\n    className: \"form-group\"\n  }, mdx(\"label\", {\n    htmlFor: \"date\",\n    className: \"control-label col-sm-8\"\n  }, \"Fertigstellung Wunschtermin *\"), mdx(\"div\", {\n    className: \"col-sm-8\"\n  }, mdx(\"input\", {\n    type: \"text\",\n    className: \"form-control\",\n    \"data-provide\": \"datepicker\",\n    \"data-date-format\": \"dd.mm.yyyy\",\n    \"data-date-language\": \"de\",\n    \"data-date-today-highlight\": \"true\",\n    \"data-date-days-of-week-disabled\": \"0,6\",\n    \"data-date-autoclose\": \"true\",\n    placeholder: \"\",\n    name: \"date\",\n    id: \"date\"\n  }), mdx(\"span\", {\n    className: \"help-block\"\n  }))), mdx(\"div\", {\n    className: \"form-group\"\n  }, mdx(\"div\", {\n    className: \"col-sm-8\"\n  }, mdx(\"br\", null), mdx(\"br\", null), mdx(\"button\", {\n    type: \"submit\",\n    className: \"btn btn-primary\"\n  }, \"Abschicken\"))))), mdx(\"br\", null), mdx(\"h2\", null, \"Finale Druckdaten\"), mdx(\"ul\", null, mdx(\"li\", null, \"Hier k\\xF6nnen Sie Ihre Druckdaten ganz einfach hochladen.\"), mdx(\"li\", null, \"Sie k\\xF6nnen pro \\xDCbertragung bis zu 200 GB senden.\")), mdx(\"br\", null), mdx(\"h2\", null, \"Upload-Link\"), mdx(\"ul\", null, mdx(\"li\", null, mdx(\"a\", {\n    href: \"//muellerprints.wetransfer.com\"\n  }, \"muellerprints.wetransfer.com\")))));\n}\n;\nMDXContent.isMDXComponent = true;"}},
    "staticQueryHashes": ["1348940310"]}